title,activity_contents,categories,url,thumbnail
Leap Year Creative Writing Prompt #2: A Time to Leap,"Get learners' creative juices flowing with this thought-provoking, leap year-inspired writing prompt! Students are asked to imagine a world where leap years open up a portal to another world or another time, reflecting on where they would ""leap"" to and why. In their written response, students are encouraged to use vivid, descriptive language to help create an immersive experience for the reader.
Ideal for a wide range of learners in fourth through eighth grade, this creative writing prompt is a fun and engaging way to help learners refine their communication skills, improve their imagination and critical thinking, and strengthen their story-telling.
This worksheet can be used independently or completed alongside the other worksheets in this series: Leap Year Creative Writing Prompt #1: A Time to Choose and Leap Year Creative Writing Prompt #3: A Time for Superpowers.
","{'brand': ['Fourth Grade', 'Fifth Grade', 'Sixth Grade', 'Seventh Grade', 'Eighth Grade'], 'subject': ['Reading & Writing', 'Writing', 'Seasonal', 'Fiction Writing', 'Winter', 'Creative Writing']}",/worksheet/article/leap-year-creative-writing-prompt-2-a-time-to-leap/,https://cdn.education.com/worksheet-image/3930611/leap-year-creative-writing-prompt-2024-01-25.gif
Leap Year Creative Writing Prompt #1: A Time to Choose,"Get learners' creative juices flowing with this thought-provoking writing prompt about leap year! The Earth’s orbit around the Sun takes about 365.25 days. Students are asked to reflect on what they would do if they were allowed to do whatever they wanted on that extra “quarter day” every year! In their written response, students are encouraged to use vivid, descriptive language to help create an immersive experience for the reader.
Ideal for a wide range of learners in fourth through eighth grade, this creative writing prompt is a fun and engaging way to help learners refine their communication skills, improve their imagination and critical thinking, and strengthen their vocabulary.
This worksheet can be used independently or completed alongside the other worksheets in this series: Leap Year Creative Writing Prompt #2: A Time to Leap and Leap Year Creative Writing Prompt #3: A Time for Superpowers.
","{'brand': ['Fourth Grade', 'Fifth Grade', 'Sixth Grade', 'Seventh Grade', 'Eighth Grade'], 'subject': ['Reading & Writing', 'Writing', 'Seasonal', 'Fiction Writing', 'Winter', 'Creative Writing']}",/worksheet/article/leap-year-creative-writing-prompt-1-a-time-to-choose/,https://cdn.education.com/worksheet-image/3930385/leap-year-creative-writing-prompt-2024-01-25.gif
Sensory Poem Template,"Engage students' senses and inspire their creativity with this sensory poem template! Sensory language—descriptive words that relate to the senses—enhances writing and creates an immersive experience for readers. This two-page worksheet guides students to plan and write a sensory poem describing an experience. Writers will use the graphic organizer on page 1 to brainstorm the sights, sounds, smells, tastes, and physical sensations they will use in each of the three stanzas. Then, when they're ready, learners will use page 2 to write their final sensory poem about their chosen experience.
Designed for middle school students, this flexible worksheet can be used as a personal reflection, creative writing practice, or a novel study extension. Check out the Figurative Language Handout to review definitions and examples of figurative language.
","{'brand': ['Sixth Grade', 'Seventh Grade', 'Eighth Grade'], 'subject': ['Reading & Writing', 'Writing', 'Fiction Writing', 'Poetry']}",/worksheet/article/sensory-poem-template/,https://cdn.education.com/worksheet-image/3930350/sensory-poem-template-2024-01-25.gif
Valentine's Day Puzzle: Integer Multiplication and Division,"Students use algebraic thinking to find the value of each symbol in this Valentine's Day math puzzle! Ideal for seventh-grade learners, this worksheet offers a fun twist on integer multiplication and division. Students are given six equations, each of which has had one or more numbers replaced with Valentine's Day-themed picture symbols. These symbols each represent the same value across all the equations, and can be either positive or negative whole numbers. Learners will need to use their logic, number sense, and understanding of operations with integers to determine the value that each symbol represents. After solving the equations, they'll record the value of each of the six symbols below.
Don't miss the Valentine's Day Puzzle: Integer Addition and Subtraction worksheet for more Valentine's Day math fun!
","{'brand': ['Seventh Grade'], 'subject': ['Math', 'Number Sense', 'Offline games', 'Mixed Operations', 'Holidays', ""Valentine's Day"", 'Puzzles & Sudoku', 'Integers and Rational Numbers', 'Operations With Integers']}",/worksheet/article/valentines-day-puzzle-integer-multiplication-and-division/,https://cdn.education.com/worksheet-image/3930323/valentine-day-puzzle-integer-multiplication-2024-01-25.gif
Valentine's Day Puzzle: Integer Addition and Subtraction,"Find the value of each symbol with this Valentine's Day math puzzle! Designed for seventh-grade learners, this worksheet offers a unique twist on integer addition and subtraction. Students are presented with six equations, each of which has two or more numbers replaced with Valentine's Day-themed picture symbols. The pictures each represent the same value across all the equations. Students will need to use their logic, number sense, and understanding of operations with integers to determine the value that each symbol represents. After solving the equations, they'll record the value of each of the six symbols below.
For more Valentine's Day math fun, check out the Valentine's Day Puzzle: Integer Multiplication and Division worksheet next!
","{'brand': ['Seventh Grade'], 'subject': ['Math', 'Number Sense', 'Offline games', 'Mixed Operations', 'Holidays', ""Valentine's Day"", 'Puzzles & Sudoku', 'Integers and Rational Numbers', 'Operations With Integers']}",/worksheet/article/valentines-day-puzzle-integer-addition-and-subtraction/,https://cdn.education.com/worksheet-image/3930306/valentine-day-puzzle-integer-addition-2024-01-25.gif
Subtract Integers Using Number Lines #3,"Offer students additional practice subtracting integers using number lines with this math worksheet! The third in a series of three, this worksheet is designed to provide seventh-grade math learners with simple, targeted practice adding both positive and negative numbers on a number line. Featuring a new set of 10 problems with differences between 8 and –8, this one-page resource is a great way to help students improve their number sense and hone their understanding of operations with integers with the help of a concrete model.
Check out the other worksheets in this series for more practice: Subtract Integers Using Number Lines #1 and Subtract Integers Using Number Lines #2.
","{'brand': ['Seventh Grade'], 'subject': ['Math', 'Subtraction', 'Number Sense', 'Subtraction Strategies', 'Integers and Rational Numbers', 'Subtraction on a Number Line', 'Operations With Integers']}",/worksheet/article/subtract-integers-using-number-lines-3/,https://cdn.education.com/worksheet-image/3929976/subtract-integers-number-lines-3-2024-01-24.gif
After-Reading Response Choice Board: Informational Text,"Give students a voice and choice in their learning with this fun after-reading response choice board! Learners are invited to choose from nine different and engaging ways to respond to an informational text, each with a primary focus on essential nonfiction reading comprehension skills. Readers can choose to write a poem focusing on key elements of the text, create a crossword puzzle that incorporates vocabulary, draft a persuasive letter to the author, and more!
Geared toward middle-grade learners, this choice board is a great way to offer engaging and differentiated learning for the analysis of nonfiction texts. This multi-use worksheet is perfect for a variety of contexts, including centers, no-prep sub-plans, close reading, teaching nonfiction reading strategies, or book reports! 
Check out After-Reading Response Choice Board: Fiction Text for a unique array of inspiring activities related to reading fiction.
","{'brand': ['Sixth Grade', 'Seventh Grade', 'Eighth Grade'], 'subject': ['Reading & Writing', 'Reading', 'Writing', 'Nonfiction Writing', 'Reading Comprehension Strategies', 'Writing Organization and Structure', 'Reflective Writing', 'Response to Literature', 'Identifying the Main Idea', 'Summarizing', 'Sequencing Events', 'Making Inferences', 'Making Connections in Reading', 'Making Predictions', 'Using Text Features', 'Summarizing Nonfiction Texts', 'Sequencing Events in Nonfiction', 'Nonfiction Text Features', 'Identifying Problems and Solutions in Reading', 'Identifying the Main Idea in Nonfiction', 'Making Inferences in Nonfiction', 'Making Connections in Nonfiction', 'Making Predictions in Nonfiction', 'Identifying Problems and Solutions in Nonfiction']}",/worksheet/article/after-reading-response-choice-board-informational-text/,https://cdn.education.com/worksheet-image/3929839/after-reading-response-choice-board-2024-01-24.gif
Figurative Language Maze: Valentine's Day Hyperbole,"Give your learners practice identifying hyperboles with this sweet, seasonal figurative language maze! Perfect for middle-grade learners, this Valentine's Day-themed maze contains a variety of figurative language examples and non-examples. Students will have the opportunity to show their knowledge of figurative language by identifying only the hyperboles amidst a sea of other techniques, including metaphors, alliteration, and rich imagery. As they follow the path of hyperboles, learners will collect letters that will reveal a mystery hyperbole at the bottom of the page!
Want more festive figurative language fun? Keep going with Figurative Language Maze: Valentine's Day Similes and Figurative Language Maze: Valentine's Day Metaphors!
","{'brand': ['Sixth Grade', 'Seventh Grade', 'Eighth Grade'], 'subject': ['Reading & Writing', 'Grammar', 'Offline games', 'Holidays', 'Mazes', ""Valentine's Day"", 'Language and Vocabulary', 'Language', 'Figurative Language', 'Hyperbole']}",/worksheet/article/figurative-language-maze-valentines-day-hyperbole/,https://cdn.education.com/worksheet-image/3929406/figurative-language-maze-valentine-day-2024-01-24.gif
Valentine's Day Spelling Word Search #2,"Give students more fun spelling practice with this Valentine's Day-themed word search puzzle! Ideal for middle grade learners, this unique spelling worksheet features 24 commonly misspelled words, all of which have some relation to Valentine's Day. Students are first asked to identify the words that are misspelled on the list and highlight them each in a different color. Then, in the word search puzzle in part 2, learners will need to find the correct spelling of the misspelled words they identified in part 1.
This fun, seasonal worksheet is a creative way to help your learner to build their vocabulary and hone their spelling skills. For additional practice, check out the Valentine's Day Spelling Word Search #1!
","{'brand': ['Sixth Grade', 'Seventh Grade', 'Eighth Grade'], 'subject': ['Reading & Writing', 'Grammar', 'Offline games', 'Spelling', 'Holidays', 'Word Search', ""Valentine's Day"", 'Irregularly Spelled Words']}",/worksheet/article/valentines-day-spelling-word-search-2/,https://cdn.education.com/worksheet-image/3929383/valentine-day-spelling-word-search-2024-01-24.gif
Valentine's Day Spelling Word Search #1,"Give your students' spelling skills a boost with this Valentine's Day-themed word search puzzle! Perfect for learners in grades six, seven, and eight, this grammar and spelling worksheet features a list of 24 commonly misspelled words, all of which are related to Valentine's Day. Students will need to identify the words that are misspelled on the list and then find the correct spelling of those words in a word search puzzle, highlighting each in a matching color. This Valentine's Day spelling worksheet is a fun and creative way to encourage learners to build their vocabulary and hone their spelling skills.
Don't miss the Valentine's Day Spelling Word Search #2 worksheet for more targeted spelling practice!
","{'brand': ['Sixth Grade', 'Seventh Grade', 'Eighth Grade'], 'subject': ['Reading & Writing', 'Grammar', 'Offline games', 'Spelling', 'Holidays', 'Word Search', ""Valentine's Day"", 'Irregularly Spelled Words']}",/worksheet/article/valentines-day-spelling-word-search-1/,https://cdn.education.com/worksheet-image/3929375/valentine-day-spelling-word-search-2024-01-24.gif
Valentine's Day Puzzle: Addition and Subtraction Within 20,"Practice addition and subtraction within 20 with this sweet Valentine’s Day math puzzle! Each of these four equations has had one or more numbers replaced with a picture. The pictures each represent the same value across all the equations. Students will need to use their knowledge of addition and subtraction to solve each equation and determine the value of each symbol. Then they'll record the value that each picture represents.
Perfect for first- and second-grade learners, this worksheet is a great way to bring problem-solving practice to Valentine's Day celebrations. Don't miss the Valentine's Day Puzzle: Addition and Subtraction Within 10 worksheet for more festive math fun!
","{'brand': ['First Grade', 'Second Grade'], 'subject': ['Math', 'Addition', 'Subtraction', 'Offline games', 'Mixed Operations', 'Holidays', 'Addition Facts', ""Valentine's Day"", 'Subtraction Facts ', 'Puzzles & Sudoku', 'Addition and Missing Addends', 'Addition Within 20', 'Subtraction and Missing Numbers', 'Mixed Addition and Subtraction', 'Subtraction Within 20']}",/worksheet/article/valentines-day-puzzle-addition-and-subtraction-within-20/,https://cdn.education.com/worksheet-image/3929966/valentine-day-puzzle-addition-subtraction-2024-01-24.gif
Valentine's Day Puzzle: Addition and Subtraction Within 10,"First and second graders will LOVE finding the missing numbers in this adorable Valentine’s Day-themed math puzzle! Each of these four equations have at least one missing number that's been replaced with a picture. Each picture has the same value across the equations. Students will need to use their understanding of addition and subtraction within 10 to balance the equations and find the value of each symbol. Then they'll record the value that each picture represents.
This worksheet is a great way to encourage students to practice their problem-solving skills. For even more Valentine's Day math fun, try the Valentine's Day Puzzle: Addition and Subtraction Within 20 worksheet next!
","{'brand': ['First Grade', 'Second Grade'], 'subject': ['Math', 'Addition', 'Subtraction', 'Offline games', 'Mixed Operations', 'Holidays', 'Addition Facts', ""Valentine's Day"", 'Subtraction Facts ', 'Puzzles & Sudoku', 'Addition and Missing Addends', 'Addition Within 10', 'Subtraction and Missing Numbers', 'Mixed Addition and Subtraction', 'Subtraction Within 10']}",/worksheet/article/valentines-day-puzzle-addition-and-subtraction-within-10/,https://cdn.education.com/worksheet-image/3929340/valentine-day-puzzle-addition-subtraction-2024-01-24.gif
"Informational Reading Comprehension: The Harlem Renaissance: A Legacy of Culture, Creativity, and Change","Explore a fascinating period of U.S. history with this informational reading worksheet about the Harlem Renaissance. This three-page worksheet invites middle school readers to delve into an original nonfiction passage about some of the causes and lasting impacts of the cultural movement. After reading the two-page informational passage, students will demonstrate their understanding of the text by answering a mix of multiple-choice and short-answer reading comprehension questions.
Take it further by asking learners to consider how music, art, or literature can be a powerful tool for positive change today. Or have students research one of the influential figures of the Harlem Renaissance and write a paragraph describing the person's individual contributions. You can introduce learners to a poetry sample from a leader of the Harlem Renaissance with the Analyzing Poetry: Mother to Son by Langston Hughes worksheet.
This worksheet is an invaluable resource as part of a U.S. history lesson or during Black History Month. For more information, check out this article from the National Museum of African American History and Culture.
","{'brand': ['Sixth Grade', 'Seventh Grade', 'Eighth Grade'], 'subject': ['Reading & Writing', 'Reading', 'Seasonal', 'Reading Genres and Types', 'Black History Month', 'Reading Comprehension Strategies', 'Nonfiction', 'Comprehension Questions', 'Cause and Effect', 'Making Connections in Reading', 'Analyzing Text Structure', 'Nonfiction Comprehension Questions', 'Making Connections in Nonfiction', 'Identifying Cause and Effect in Nonfiction']}",/worksheet/article/informational-reading-comprehension-the-harlem-renaissance-a-legacy-of-culture-creativity-and-change/,https://cdn.education.com/worksheet-image/3928776/informational-reading-comprehension-harlem-renaissance-2024-01-23.gif
Valentine’s Day Gift Mix-up Logic Problem,"It’s Valentine’s Day, and five friends each received a different gift. Have students put their logic and reasoning skills to the test in order to find out which present each friend received! In this sweet and festive Valentine's Day-themed worksheet, students are given four clues to help them determine the correct answers to this logic puzzle. Young sleuths will use the clues and the 5x5 grid to help them narrow down their answers, and then they will complete each of the sentences with the correct gift.
Ideal for third- and fourth-grade learners, this engaging puzzle worksheet is a great way to provide students with some seasonal fun while supporting and building their critical thinking skills!
","{'brand': ['Third Grade', 'Fourth Grade'], 'subject': ['Offline games', 'Holidays', ""Valentine's Day"", 'Puzzles & Sudoku']}",/worksheet/article/valentines-day-gift-mix-up-logic-puzzle/,https://cdn.education.com/worksheet-image/3928654/valentine-day-gift-mix-up-2024-01-23.gif
Valentine's Day Argument Writing Prompt #3: School Celebrations,"Should schools host parties or other special events for students on Valentine’s Day? This worksheet invites learners to write an argumentative response to this Valentine’s Day-themed writing prompt. Designed for sixth, seventh, and eighth-grade learners, this prompt will engage students in writing their claim about the topic, supporting that claim with relevant evidence and reasoning, and also acknowledging different opinions and perspectives on the matter.
This argument writing prompt can be used independently or completed alongside the other Valentine’s Day writing prompts: Valentine's Day Argument Writing Prompt #1: Gift Exchange and Valentine's Day Argument Writing Prompt #2: Candy Consumption. And don't miss the 6th grade, 7th grade, and 8th grade standards-based argument writing rubrics to help assess student work.
","{'brand': ['Sixth Grade', 'Seventh Grade', 'Eighth Grade'], 'subject': ['Reading & Writing', 'Writing', 'Holidays', 'Nonfiction Writing', ""Valentine's Day"", 'Argument Writing']}",/worksheet/article/valentines-day-argument-writing-prompt-3-school-celebrations/,https://cdn.education.com/worksheet-image/3928021/valentine-day-argument-writing-prompt-2024-01-22.gif
Valentine's Day Argument Writing Prompt #2: Candy Consumption,"Should students be allowed to eat Valentine’s Day candy throughout the school day? This worksheet invites learners to write an argumentative response to this Valentine’s Day-themed writing prompt. Designed for sixth, seventh, and eighth-grade learners, this prompt will engage students in writing their claim about the topic, supporting that claim with relevant evidence and reasoning, and also acknowledging different opinions and perspectives on the matter.
This argument writing prompt can be used independently or completed alongside the other Valentine’s Day writing prompts: Valentine's Day Argument Writing Prompt #1: Gift Exchange and Valentine's Day Argument Writing Prompt #3: School Celebrations. And don't miss the 6th grade, 7th grade, and 8th grade standards-based argument writing rubrics to help assess student work.
","{'brand': ['Sixth Grade', 'Seventh Grade', 'Eighth Grade'], 'subject': ['Reading & Writing', 'Writing', 'Holidays', 'Nonfiction Writing', ""Valentine's Day"", 'Argument Writing']}",/worksheet/article/valentines-day-argument-writing-prompt-2-candy-consumption/,https://cdn.education.com/worksheet-image/3928011/valentine-day-argument-writing-prompt-2024-01-22.gif
Valentine's Day Argument Writing Prompt #1: Gift Exchange,"Should students be allowed to exchange Valentine’s Day gifts throughout the school day with friends? This worksheet invites learners to write an argumentative response to this Valentine’s Day-themed writing prompt. Designed for sixth, seventh, and eighth-grade learners, this prompt will engage students in writing their claim about the topic, supporting that claim with relevant evidence and reasoning, and also acknowledging different opinions and perspectives on the matter.
This argument writing prompt can be used independently or completed alongside the other Valentine’s Day writing prompts: Valentine's Day Argument Writing Prompt #2: Candy Consumption and Valentine's Day Argument Writing Prompt #3: School Celebrations. And don't miss the 6th grade, 7th grade, and 8th grade standards-based argument writing rubrics to help assess student work.
","{'brand': ['Sixth Grade', 'Seventh Grade', 'Eighth Grade'], 'subject': ['Reading & Writing', 'Writing', 'Holidays', 'Nonfiction Writing', ""Valentine's Day"", 'Argument Writing']}",/worksheet/article/valentines-day-argument-writing-prompt-1-gift-exchange/,https://cdn.education.com/worksheet-image/3927985/valentine-day-argument-writing-prompt-2024-01-22.gif
"Rhetorical Appeals With Ethos, Pathos, and Logos: Pet Rock Mascot","Infuse your classroom with innovation, creativity, and passion with this unique writing activity students will love! Rhetorical appeals encompass three fundamental strategies: ethos, pathos, and logos. These appeals serve as the building blocks of persuasive arguments. In this creative and persuasive writing worksheet, learners are invited to design the most incredible pet rock. Then, in the boxes provided, students will use the rhetorical appeals of ethos, pathos, and logos to persuade the audience to adopt their rock as the classroom mascot.
Take it to the next level and invite students to combine their rhetorical appeals into a persuasive pitch before sharing it with their classmates. Have them present their rock and attempt to convince their class to choose their rock in a Stone Showdown!
For more argumentative writing worksheets for middle grades, check out the Argument Writing Graphic Organizer: Should It Be Allowed? worksheet!
","{'brand': ['Seventh Grade', 'Eighth Grade'], 'subject': ['Reading & Writing', 'Writing', 'Fiction Writing', 'Nonfiction Writing', 'Creative Writing', 'Persuasive Writing']}",/worksheet/article/rhetorical-appeals-with-ethos-pathos-and-logos-pet-rock-mascot/,https://cdn.education.com/worksheet-image/3927815/rhetorical-appeals-ethos-pathos-logos-2024-01-22.gif
Novel Study: Wonder: Write Your Postcard Precept,"After finishing R.J. Palacio’s novel Wonder, encourage students to create their own precepts with this unique and engaging extension activity! On the first day of school, Auggie’s English teacher, Mr. Browne, introduces students to precepts. He says, “Basically, a precept is anything that helps guide us when making decisions about really important things.” Throughout the book, Mr. Browne introduces a new precept of the month and asks students to write a response. 
In this creative and artistic activity, students will write a postcard to Mr. Browne with their own precept. After cutting out the postcard, learners will write a precept reflecting a core truth about the world and explain why they chose it. Then they will illustrate the back of the postcard with an image related to their chosen precept. For inspiration and examples, encourage students to use the Appendix of Wonder that lists Mr. Browne's monthly precepts and the ""Postcard Precepts"" from the students.
For additional resources related to this novel, be sure to check out the set of novel study worksheets for Wonder.
","{'brand': ['Fourth Grade', 'Fifth Grade', 'Sixth Grade'], 'subject': ['Reading & Writing', 'Reading', 'Writing', 'Fiction Writing', 'Nonfiction Writing', 'Reading Genres and Types', 'Reading Comprehension Strategies', 'Creative Writing', 'Novel Study', 'Reflective Writing', 'Making Connections in Reading', 'Making Connections in Fiction']}",/worksheet/article/novel-study-wonder-write-your-postcard-precept/,https://cdn.education.com/worksheet-image/3927716/study-write-postcard-precept-2024-03-04.gif
