title,activity_contents,categories,url,thumbnail
Winter Word Sort: Schwa Vowel Sounds #1,"Boost your child's reading skills with this winter-themed word sorting worksheet! Designed for first, second, and third graders, this fun coloring activity helps learners practice recognizing and decoding words with and without the ""schwa"" sound, a common but often overlooked vowel sound in the English language. The ""schwa"" sound is a weak, unstressed vowel sound that is pronounced when the mouth is almost closed. It typically makes a relaxed short u or short i sound, such as in the words from, love, and again, and it can be spelled with any vowel.
In this helpful phonics worksheet, learners are asked to color the words with a ""schwa"" sound blue, and the words that do not have a ""schwa"" sound yellow. By sorting words with and without the ""schwa"" sound, students will practice a key reading skill that will help them decode longer words more easily and improve their spelling skills. Use this snowman-themed worksheet at home or in the classrooom to support your child's reading progress and make learning fun during the winter season!
Keep practicing with the other worksheets in this series: Winter Word Sort: Schwa Vowel Sounds #2 and Winter Word Sort: Schwa Vowel Sounds #3.
","{'brand': ['First Grade', 'Second Grade', 'Third Grade'], 'subject': ['Reading & Writing', 'Grammar', 'Phonics', 'Seasonal', 'Winter', 'Letter Sounds', 'Ending Sounds', 'Decoding Words', 'Beginning Sounds']}",/worksheet/article/winter-word-sort-schwa-vowel-sounds-1/,https://cdn.education.com/worksheet-image/3959544/winter-word-sort-schwa-vowel-2024-03-05.gif
Research Graphic Organizer: Passover,"Invite your students to explore the holiday of Passover by conducting research and recording their findings using this helpful research template! This simple and appealing graphic organizer features five guiding prompts that ask students to collect some basic information about this religious holiday. Learners will explore when, why, and how Passover is celebrated, record any music, clothing, foods, traditions, and more that have come to be associated with the holiday, and draw a symbol that represents it.
Perfect for a wide range of learners in fourth through eighth grade, this graphic organizer offers learners a useful framework for conducting thoughtful research. Use it on its own or in tandem with the Reflective Writing Prompt: Passover worksheet. Or, for a comparative study, have students research, record, and compare their findings about some of the other widely celebrated spring religious holidays using the Research Graphic Organizer: Easter and Research Graphic Organizer: Ramadan worksheets!
","{'brand': ['Fourth Grade', 'Fifth Grade', 'Sixth Grade', 'Seventh Grade', 'Eighth Grade'], 'subject': ['Reading & Writing', 'Writing', 'Seasonal', 'Holidays', 'Spring', 'Nonfiction Writing', 'Teacher Resources', 'Passover', 'Templates', 'Research Writing']}",/worksheet/article/research-graphic-organizer-passover/,https://cdn.education.com/worksheet-image/3959122/research-graphic-organizer-passover-2024-03-05.gif
Reflective Writing Prompt: Passover,"How do stories of endurance and hope impact us? Inspire students to think deeply with this Passover-themed writing prompt! Using this reflective writing worksheet as a jumping off point, learners are guided to make connections between the religious holiday Passover and their daily experiences. Writers will begin by reading a brief informational paragraph about Passover, and then they will use the prompts provided to guide their written responses. Learners are asked to reflect on how stories of endurance and hope, such as the story told at Passover dinner, inspire them to overcome obstacles in their own lives.
Reflective writing helps elementary and middle school students understand and learn from their experiences by examining their thoughts, feelings, and actions. It is a great way to encourage self-awareness, critical thinking, and personal growth.
Ideal for a wide range of learners in fourth through eighth grade, this reflective writing prompt can be used in tandem with the Research Graphic Organizer: Passover.
","{'brand': ['Fourth Grade', 'Fifth Grade', 'Sixth Grade', 'Seventh Grade', 'Eighth Grade'], 'subject': ['Reading & Writing', 'Writing', 'Seasonal', 'Holidays', 'Spring', 'Nonfiction Writing', 'Passover', 'Reflective Writing']}",/worksheet/article/reflective-writing-prompt-passover/,https://cdn.education.com/worksheet-image/3959079/reflective-writing-prompt-passover-2024-03-05.gif
Methods of Charging Part 1: Charging by Friction,"Have you ever wondered why going down a slide can make your hair stand on end? Learn all about charging by friction with this fascinating science worksheet for middle grades! In this two-page worksheet, students will read through a scenario in which a child goes down a plastic slide and finds their hair standing up. As they read the text and review the diagrams, young scientists will learn about the structure of atoms, explore how an object can become charged through electron transfer, and discover how charged objects interact. Then, on page 2,  students will answer critical thinking questions that further explore and build upon the scenario they read.
This worksheet is the first in a series of worksheets on methods of charging. Keep learning about forces and interactions with the Newton's First Law of Motion worksheet!
","{'brand': ['Sixth Grade', 'Seventh Grade', 'Eighth Grade'], 'subject': ['Science', 'Physical Science', 'Forces and Interactions']}",/worksheet/article/methods-of-charging-part-1-charging-by-friction/,https://cdn.education.com/worksheet-image/3958278/methods-charging-part-1-charging-2024-03-04.gif
How Many? St. Patrick's Day Counting #3,"How many pots of gold are in each set? This St. Patrick’s Day, give your learners some lucky practice counting and writing within 20! This St. Patrick's Day-themed math worksheet invites children to count how many pots of gold are displayed in each section and record the correct number. Featuring two-digit numbers within 20, this activity gives students a chance to practice counting objects in a line, rectangular array, circle, and scattered configuration. Handwriting lines are provided to assist preschool and kindergarten learners as they write the total number of objects in each problem.
Don't miss the other worksheets in this seasonal series: How Many? St. Patrick's Day Counting #1 and How Many? St. Patrick's Day Counting #2!
","{'brand': ['Preschool', 'Kindergarten'], 'subject': ['Math', 'Number Sense', 'Holidays', 'Numbers 0-10', 'Numbers 11-20', ""St. Patrick's Day"", 'Writing Numbers 0-10', 'Counting Numbers 1-10', 'Writing Numbers 11-20', 'Counting Numbers 11-20']}",/worksheet/article/how-many-st-patricks-day-counting-3/,https://cdn.education.com/worksheet-image/3960080/st-patrick-day-counting-3-2024-03-06.gif
How Many? St. Patrick's Day Counting #2,"How many hats are in each set? Practice counting and writing number within 20 in this St. Patrick’s Day themed-worksheet! Perfect for your youngest learners in preschool and kindergarten, this number sense worksheet invites children to count how many leprechaun hats are displayed in each section and record the correct number. Students will get an opportunity to practice counting objects in a line, rectangular array, circle, and scattered configuration. Handwriting lines are provided to assist students as they write each total number of hats in each problem.
Keep on counting with the other worksheets in this seasonal series: How Many? St. Patrick's Day Counting #1 and How Many? St. Patrick's Day Counting #3!
","{'brand': ['Preschool', 'Kindergarten'], 'subject': ['Math', 'Number Sense', 'Holidays', 'Numbers 0-10', 'Numbers 11-20', ""St. Patrick's Day"", 'Writing Numbers 0-10', 'Counting Numbers 1-10', 'Writing Numbers 11-20', 'Counting Numbers 11-20']}",/worksheet/article/how-many-st-patricks-day-counting-2/,https://cdn.education.com/worksheet-image/3956881/st-patrick-day-counting-2-2024-03-01.gif
How Many? St. Patrick's Day Counting #1,"You’re in luck because young learners will love practicing counting and writing numbers within 20 in this St. Patrick’s Day themed-worksheet! Perfect for students in preschool and kindergarten, this early math worksheet asks learners to count how many gold coins are displayed in each section and record the correct number. Children will get an opportunity to practice counting objects in a line, rectangular array, circle, and scattered configuration. Handwriting lines are provided to assist students as they write each total number of coins in each problem.
Don't stop there! Keep counting on with the How Many? St. Patrick's Day Counting #2 and How Many? St. Patrick's Day Counting #3 worksheets!
","{'brand': ['Preschool', 'Kindergarten'], 'subject': ['Math', 'Number Sense', 'Holidays', 'Numbers 0-10', 'Numbers 11-20', ""St. Patrick's Day"", 'Writing Numbers 0-10', 'Counting Numbers 1-10', 'Writing Numbers 11-20', 'Counting Numbers 11-20']}",/worksheet/article/how-many-st-patricks-day-counting-1/,https://cdn.education.com/worksheet-image/3960067/st-patrick-day-counting-1-2024-03-06.gif
Research Graphic Organizer: Easter,"Invite learners to learn about Easter by conducting research and recording their findings using this helpful research template! This spring-inspired graphic organizer features five guiding prompts that ask students to collect some basic information about this religious holiday. Learners will explore when, why, and how Easter is celebrated, record any music, clothing, foods, traditions, and more that have come to be associated with the holiday, and draw a symbol that represents it.
Ideal for a wide range of learners in fourth through eighth grade, this graphic organizer offers learners a useful framework for conducting thoughtful research. Use it on its own or alongside the Reflective Writing Prompt: Easter worksheet.
","{'brand': ['Fourth Grade', 'Fifth Grade', 'Sixth Grade', 'Seventh Grade', 'Eighth Grade'], 'subject': ['Reading & Writing', 'Writing', 'Holidays', 'Seasonal', 'Easter', 'Spring', 'Nonfiction Writing', 'Teacher Resources', 'Templates', 'Research Writing']}",/worksheet/article/research-graphic-organizer-easter/,https://cdn.education.com/worksheet-image/3956798/research-graphic-organizer-easter-2024-03-01.gif
Reflective Writing Prompt: Easter,"How can you show love to your friends and family? Inspire deep thinking and reflection with this Easter-themed writing prompt! With the help of this reflective writing worksheet, students will strive to make connections between the religious holiday Easter and their daily experiences. Learners will begin by reading a brief informational paragraph about Easter, and then they will use the prompts provided to guide their responses. Writers are asked to reflect on what it feels like to have hope and joy in their lives, as well as how they can share those feelings with others.
Reflective writing helps elementary and middle school students understand and learn from their experiences by examining their thoughts, feelings, and actions. It is a great way to encourage self-awareness, critical thinking, and personal growth.
Ideal for a wide range of learners in fourth through eighth grade, this reflective writing prompt can be used in tandem with the Research Graphic Organizer: Easter.
","{'brand': ['Fourth Grade', 'Fifth Grade', 'Sixth Grade', 'Seventh Grade', 'Eighth Grade'], 'subject': ['Reading & Writing', 'Writing', 'Seasonal', 'Holidays', 'Spring', 'Easter', 'Nonfiction Writing', 'Reflective Writing']}",/worksheet/article/reflective-writing-prompt-easter/,https://cdn.education.com/worksheet-image/3956765/reflective-writing-prompt-easter-2024-03-01.gif
Identify Relative Pronouns,"Practice identifying relative pronouns in the context of written sentences with this grammar worksheet! A relative pronoun introduces a relative clause that describes a noun or pronoun. The five main relative pronouns are who, whom, whose, which, and that. After reviewing the definition and several examples of relative pronouns at work, students will read 10 sentences and circle the relative pronoun in each one.
Geared toward fourth- and fifth-grade learners, this helpful grammar and mechanics exercise exposes students to the most common relative pronouns and provides an opportunity for learners to identify the various kinds in context.
For more grammar-based review and practice activities, check out the Parts of Speech Review: Common and Proper Nouns or Parts of Speech Review: Concrete and Abstract Nouns worksheets next!
","{'brand': ['Fourth Grade', 'Fifth Grade'], 'subject': ['Reading & Writing', 'Grammar', 'Grammar and Mechanics', 'Parts of Speech', 'Pronouns', 'Relative Pronouns']}",/worksheet/article/identify-relative-pronouns/,https://cdn.education.com/worksheet-image/3956749/identify-relative-pronouns-2024-03-01.gif
Figurative Language Maze: Winter Hyperbole,"Practice identifying hyperbole with this engaging winter-themed figurative language maze! This figurative language worksheet invites middle school learners to find the path through the maze by identifying only the spaces containing examples of hyperbole. As they follow the path from start to finish, students will put their knowledge of figurative language techniques to the test by identifying only the hyperbole and avoiding similes, metaphors, and more. Once they've reached the end of the maze, learners will record each letter they collected along the way to complete the mystery hyperbole at the bottom of the page.
For more wintry grammar practice, check out the Figurative Language Maze: Winter Similes and Figurative Language Maze: Winter Metaphors worksheets!
","{'brand': ['Sixth Grade', 'Seventh Grade', 'Eighth Grade'], 'subject': ['Reading & Writing', 'Grammar', 'Offline games', 'Seasonal', 'Mazes', 'Winter', 'Language and Vocabulary', 'Language', 'Figurative Language', 'Hyperbole']}",/worksheet/article/figurative-language-maze-winter-hyperbole/,https://cdn.education.com/worksheet-image/3956148/figurative-language-maze-winter-hyperbole-2024-02-29.gif
Winter Word Sort: Open and Closed Syllables #3,"Get more fun phonics practice this winter with this open and closed syllable sort! Designed for first-grade readers, this phonics worksheet invites learners to sort open- and closed-syllable words by coloring them different colors. Students will read and review words such as fly, shiny, hunter, and fish, coloring the words with an open syllable red, and coloring the words with a closed syllable yellow. 
Part of a larger series of grammar worksheets, this word sort will help students learn to predict which vowel sound to use when decoding unfamiliar multisyllabic words, which is an important skill for improving spelling and reading fluency!
Don't miss the other worksheets in this series: Winter Word Sort: Open and Closed Syllables #1 and Winter Word Sort: Open and Closed Syllables #2! Or check out the Winter Word Sort: One- and Two-Syllable Words #1 worksheet for more related phonics practice.
","{'brand': ['First Grade', 'Second Grade'], 'subject': ['Reading & Writing', 'Grammar', 'Phonics', 'Syllables', 'Letter Sounds', 'Decoding Words', 'Blending Syllables']}",/worksheet/article/winter-word-sort-open-and-closed-syllables-3/,https://cdn.education.com/worksheet-image/3955734/winter-word-sort-open-closed-2024-02-29.gif
Winter Word Sort: Open and Closed Syllables #2,"Give students more word study practice this winter with this engaging open and closed syllable sort! Perfect for first-grade readers, this grammar worksheet invites learners to sort open- and closed-syllable words by coloring them different colors. Students will review words such as stuck, lady, tent, and mitten, coloring the words with an open syllable purple, and coloring the words with a closed syllable green. 
Part of a larger series of coloring phonics worksheets, this word sort is a fun way to prepare students to predict which vowel sound to use when decoding unfamiliar multisyllabic words, which is an important skill for improving spelling and reading fluency!
For more related practice, don't miss: Winter Word Sort: Open and Closed Syllables #1 and Winter Word Sort: Open and Closed Syllables #3!
","{'brand': ['First Grade', 'Second Grade'], 'subject': ['Reading & Writing', 'Grammar', 'Phonics', 'Syllables', 'Letter Sounds', 'Decoding Words', 'Blending Syllables']}",/worksheet/article/winter-word-sort-open-and-closed-syllables-2/,https://cdn.education.com/worksheet-image/3955720/winter-word-sort-open-closed-2024-02-29.gif
St. Patrick's Day Spelling Word Search #2,"Incorporate spelling practice into your St. Patrick's Day celebrations with this fun word search activity! This unique spelling worksheet features a word bank with 24 words related to St. Patrick's Day, but only some of them are spelled correctly. Students will first identify which words are spelled incorrectly and highlight them in the word bank, using a unique color for each word. Then, using the same colors from Part 1, learners will need to seek out the correct spelling of those words in the corresponding word search puzzle.
With words like traditional, potatoes, and laughter, this engaging word puzzle worksheet is a unique way to encourage sixth-, seventh-, and eighth-grade learners to practice spelling skills and grow their vocabulary, all while celebrating St. Patrick's Day!
Don't miss the first worksheet in this two-part spelling series: St. Patrick's Day Spelling Word Search #1!
","{'brand': ['Sixth Grade', 'Seventh Grade', 'Eighth Grade'], 'subject': ['Reading & Writing', 'Grammar', 'Offline games', 'Spelling', 'Holidays', 'Word Search', ""St. Patrick's Day"", 'Irregularly Spelled Words']}",/worksheet/article/st-patricks-day-spelling-word-search-2/,https://cdn.education.com/worksheet-image/3955403/st-patrick-day-spelling-word-2024-02-28.gif
St. Patrick's Day Spelling Word Search #1,"Brush up on some St. Patrick's Day-themed spelling words with this creative word search activity! This worksheet features a word bank with 24 words related to this beloved March holiday, but only some of them are spelled correctly. Students will need to first identify which words are spelled incorrectly and highlight them in the word bank, using a different color for each word. Then, using the same colors from Part 1, learners will need to seek out the correct spelling of those words in the corresponding word search puzzle.
Featuring words like horseshoe, mythology, and knot, this word puzzle worksheet is a fun way to help sixth-, seventh-, and eighth-grade learners hone spelling skills and expand their vocabulary, all while celebrating St. Patrick's Day!
Keep the festive fun going with St. Patrick's Day Spelling Word Search #2!
","{'brand': ['Sixth Grade', 'Seventh Grade', 'Eighth Grade'], 'subject': ['Reading & Writing', 'Grammar', 'Offline games', 'Spelling', 'Holidays', 'Word Search', ""St. Patrick's Day"", 'Irregularly Spelled Words']}",/worksheet/article/st-patricks-day-spelling-word-search-1/,https://cdn.education.com/worksheet-image/3955395/st-patrick-day-spelling-word-2024-02-28.gif
Novel Study: Wonder: Discussion Guide #3,"Encourage critical thinking and literacy skills with these discussion questions as students read part 4 of R.J. Palacio’s Wonder. Geared toward fourth-, fifth-, and sixth-grade readers, this discussion guide focuses on the chapters ""The Call"" through ""The Boyfriend,"" corresponding to pages 133–185 in the novel's 2017 hardcopy Random House edition. With the guidance of several in-depth comprehension, analysis, and connection questions, readers will examine Jack’s point of view of the events described in the book and compare it to August’s version of events. Then, students will analyze the new plot points and consider the role of friendship in middle school.
Whether used to spark a classroom discussion or as individual writing prompts, these thought-provoking questions are an engaging way to help learners review essential reading comprehension skills. Click “View answer key” to see sample student responses and context.
For more resources related to the novel, don't miss the full set of Wonder  worksheets!
","{'brand': ['Fourth Grade', 'Fifth Grade', 'Sixth Grade'], 'subject': ['Reading & Writing', 'Reading', 'Reading Genres and Types', 'Reading Comprehension Strategies', 'Novel Study', 'Identifying the Main Idea', 'Summarizing', 'Comprehension Questions', ""Identifying the Author's Purpose"", 'Cause and Effect', 'Sequencing Events', 'Making Inferences', 'Making Predictions', 'Making Connections in Reading', 'Comparing and Contrasting', 'Summarizing Fiction Texts', 'Sequencing in Fiction', ""Author's Purpose in Fiction"", 'Fiction Comprehension Questions', 'Identifying Problems and Solutions in Reading', 'Identifying the Main Idea in Fiction', 'Making Inferences in Fiction', 'Making Predictions in Fiction', 'Making Connections in Fiction', 'Identifying Cause and Effect in Fiction', 'Comparing and Contrasting in Fiction', 'Identifying Problems and Solutions in Fiction']}",/worksheet/article/novel-study-wonder-discussion-guide-3/,https://cdn.education.com/worksheet-image/3955366/study-discussion-guide-3-2024-02-28.gif
How Many Pies? #3,"Satisfy a sweet tooth while counting objects from 0–30 with this tasty, pie-themed worksheet! Geared toward learners in preschool and kindergarten, this early math worksheet features a variety of pies and asks students to determine the number of each type. Learners will count and then write the number of each type of pie (within 20) before finding the total number of pies (which will be a number within 30). 
Whether used in honor of Pi Day in March or to celebrate Thanksgiving in the fall, this engaging worksheet is a great way to help learners build important counting and number sense skills! For practice counting and writing numbers within 20, don't miss the How Many Pies? #1 and How Many Pies #2 worksheets. And for additional counting practice with a different twist, check out the Creature Counting worksheet next!
","{'brand': ['Preschool', 'Kindergarten'], 'subject': ['Math', 'Number Sense', 'Holidays', 'Seasonal', 'Fall', 'Numbers 0-10', 'Numbers 11-20', 'Thanksgiving', 'Writing Numbers 0-10', 'Counting Numbers 1-10', 'Writing Numbers 11-20', 'Counting Numbers 11-20']}",/worksheet/article/how-many-pies-3/,https://cdn.education.com/worksheet-image/3955259/pies-3-2024-02-28.gif
How Many Pies? #2,"Give learners a taste of counting objects from 0–20 in this delicious, pie-themed worksheet! Ideal for learners in preschool and kindergarten, this early math worksheet features a variety of pies and asks students to determine the number of each type. Learners will count and then write the number of each type of pie (within 10) before finding the total number of pies (which will be a number within 20). 
Perfect for celebrating Pi Day or Thanksgiving, this counting worksheet is a great activity to help learners build important counting and number sense skills! Don't miss the other worksheets in this series for more fun practice: How Many Pies? #1 and How Many Pies #3.
","{'brand': ['Preschool', 'Kindergarten'], 'subject': ['Math', 'Number Sense', 'Holidays', 'Seasonal', 'Fall', 'Numbers 0-10', 'Numbers 11-20', 'Thanksgiving', 'Writing Numbers 0-10', 'Counting Numbers 1-10', 'Writing Numbers 11-20', 'Counting Numbers 11-20']}",/worksheet/article/how-many-pies-2/,https://cdn.education.com/worksheet-image/3955231/pies-2-2024-02-28.gif
How Many Pies? #1,"Learners will have a “berry” good time counting objects from 0-15 in this sweet, pie-themed worksheet! Perfect for your youngest learners in preschool and kindergarten, this early math worksheet features a variety of pies and asks students to determine the number of each type. Learners will count and then write the number of each type of pie (within 10) before finding the total number of pies (which will be a number within 20). Handwriting lines are provided to assist students as they write each total.
This delicious counting activity is a great way to get younger students involved in celebrating Pi Day or Thanksgiving, all while building important counting and number sense skills! Ready for some slightly more advanced counting practice to 20 and beyond? Then be sure to check out How Many Pies? #2 and How Many Pies #3 next!
","{'brand': ['Preschool', 'Kindergarten'], 'subject': ['Math', 'Number Sense', 'Holidays', 'Seasonal', 'Fall', 'Numbers 0-10', 'Numbers 11-20', 'Thanksgiving', 'Writing Numbers 0-10', 'Counting Numbers 1-10', 'Writing Numbers 11-20', 'Counting Numbers 11-20']}",/worksheet/article/how-many-pies-1/,https://cdn.education.com/worksheet-image/3955214/pies-1-2024-02-28.gif
