title,activity_contents,categories,url,thumbnail
Find Two-Dimensional Shapes #2,"Get more fun practice identifying and coloring two-dimensional shapes with this engaging kindergarten geometry worksheet! The second in a two-part series, this simple and inviting math worksheet features a new mix of two-dimensional and three-dimensional shapes spread across four rows. Students are asked to shade in only the two-dimensional shapes in each row. This activity is a great opportunity to remind learners how to tell the difference between 2D, or flat, shapes and 3D, or solid, shapes.
For more fun practice, don't miss the Find the Two-Dimensional Shapes #1 worksheet! Or take learning one step further with Find Three-Dimensional Shapes #1 and Find Three-Dimensional Shapes #2.
","{'brand': ['Kindergarten'], 'subject': ['Math', 'Geometry', '2D Shapes', 'Flat Shapes']}",/worksheet/article/find-two-dimensional-shapes-2/,https://cdn.education.com/worksheet-image/3883941/find-two-dimensional-shapes-2-2023-11-13.gif
Find Two-Dimensional Shapes #1,"Practice identifying and coloring two-dimensional shapes with this engaging geometry worksheet! Perfect for kindergarten learners, this simple and inviting math worksheet features a mix of two-dimensional and three-dimensional shapes spread across four rows. Students are asked to shade in only the two-dimensional shapes in each row. This activity is a great opportunity to remind learners how to tell the difference between 2D, or flat, shapes and 3D, or solid, shapes.
For more fun practice, check out the Find the Two-Dimensional Shapes #2 worksheet next!
","{'brand': ['Kindergarten'], 'subject': ['Math', 'Geometry', '2D Shapes', 'Flat Shapes']}",/worksheet/article/find-two-dimensional-shapes-1/,https://cdn.education.com/worksheet-image/3883932/find-two-dimensional-shapes-1-2023-11-13.gif
Perimeter on the Coordinate Plane #3,"Give learners additional practice finding perimeter on the coordinate plane with this sixth-grade math worksheet! The third in a series of three, this one-page geometry worksheet provides learners with six different sets of ordered pairs that represent the vertices of different squares and rectangles. Students are asked to plot, label, and connect the vertices on the coordinate plane to create each shape. Then, learners will need to find the perimeter of each shape and record it in the spaces provided.
For more practice, check out the Perimeter on the Coordinate Plane #1 and Perimeter on the Coordinate Plane #2 worksheets!
","{'brand': ['Sixth Grade'], 'subject': ['Math', 'Geometry', 'Data and Graphing', 'Perimeter', 'Coordinate Planes', 'Perimeter of a Rectangle']}",/worksheet/article/perimeter-on-the-coordinate-plane-3/,https://cdn.education.com/worksheet-image/3883905/perimeter-coordinate-plane-3-2023-11-13.gif
Lunar Eclipses,"Explore how, when, and why lunar eclipses occur with this two-page earth science worksheet! Using diagrams and critical thinking skills, students will answer questions to gain a better understanding of the sun-Earth-moon system during a lunar eclipse, the phase of the moon during a lunar eclipse, and why lunar eclipses are only possible at some times of year and impossible at others. Featuring helpful illustrations and interesting facts, this worksheet is a great way to encourage learners to dig deeper into the natural world around them.
Looking for more middle school science worksheets related to outer space and the Earth-sun-moon system? Check out the Earth-Sun-Moon System: Phases of the Moon or Solar Eclipses worksheets next!
","{'brand': ['Sixth Grade', 'Seventh Grade', 'Eighth Grade'], 'subject': ['Science', 'Earth & Space Science', 'Outer Space']}",/worksheet/article/lunar-eclipses/,https://cdn.education.com/worksheet-image/3882328/lunar-eclipses-2023-11-29.gif
Vocabulary Toolkit: Vocabulary Connections Map,"Encourage students to make connections as they learn new vocabulary with this Vocabulary Connections Map! One of the best ways to remember new information is by building connections in the brain. This works with vocabulary, too! Adaptable to a wide range of subjects, this creative vocabulary exercise gets students thinking about the meaning of a vocabulary term in the context of related words and ideas. Using the instructions and example on page 1 and the templates on pages 2 and 3, students will create their own vocabulary connections maps by writing their vocabulary word in the center of the map and then adding words or phrases and drawing lines to show how they connect.
Explicit vocabulary instruction and tools such as this are a great way to support English Language Learners and students needing additional vocabulary development. This graphic organizer is intentionally flexible to best support instruction in a middle school classroom or at home. 
Interested in more versatile vocabulary worksheets for older students? Check out our Vocabulary Toolkit set!
","{'brand': ['Fourth Grade', 'Fifth Grade', 'Sixth Grade', 'Seventh Grade', 'Eighth Grade'], 'subject': ['Reading & Writing', 'Grammar', 'Teacher Resources', 'Language and Vocabulary', 'Vocabulary']}",/worksheet/article/vocabulary-toolkit-vocabulary-connections-map/,https://cdn.education.com/worksheet-image/3882297/vocabulary-toolkit-vocabulary-connections-map-2023-11-10.gif
Book Study: The Boy Who Harnessed the Wind: Discussion Guide #1,"Use this discussion guide to support readers’ comprehension as they begin reading William Kamkwamba’s The Boy Who Harnessed the Wind. Designed for seventh- and eighth-grade students, this two-page worksheet features a variety of comprehension, analysis, and personal connection questions for the book's prologue and chapters 1–3. As students reflect on and discuss the first several chapters of this nonfiction account, they will have an opportunity to review important story elements, evaluate the author’s choices, and connect to other texts and their lives.
For sample student responses, click ""View answer key."" And for more novel-specific activities, check out our complete set of worksheets related to The Boy Who Harnessed the Wind.
","{'brand': ['Seventh Grade', 'Eighth Grade'], 'subject': ['Reading & Writing', 'Reading', 'Reading Genres and Types', 'Reading Comprehension Strategies', 'Novel Study', 'Comprehension Questions', ""Identifying the Author's Purpose"", 'Central Message', 'Cause and Effect', 'Making Inferences', 'Sequencing Events', 'Analyzing Story Structure', 'Comparing and Contrasting', 'Sequencing Events in Nonfiction', ""Author's Purpose in Nonfiction"", 'Identifying Problems and Solutions in Reading', 'Nonfiction Comprehension Questions', 'Analyzing Point of View', 'Making Inferences in Nonfiction', 'Identifying Cause and Effect in Nonfiction', 'Comparing and Contrasting in Nonfiction', 'Identifying Problems and Solutions in Nonfiction']}",/worksheet/article/book-study-the-boy-who-harnessed-the-wind-discussion-guide-1/,https://cdn.education.com/worksheet-image/3881504/boy-harnessed-wind-discussion-guide-2023-11-09.gif
Parts of Speech: Adjectives,"Provide learners with a solid foundational understanding of adjectives with the help of this grammar worksheet! An adjective is a word that describes a person, animal, place, or thing. Some adjectives answer the question ""what kind?"" And some other adjectives answer the question ""how many?"" 
In this one-page practice worksheet, students will explore how adjectives are used in sentences while learning to distinguish between adjectives that describe what kind or how many.
Ideal for third- and fourth-grade learners, this worksheet is a great resource to help students review this essential part of speech that brings detail to their writing and to the texts they read.
Use this Adjectives Handout as a visual reference for learners as they build their understanding of parts of speech. And for more practice with adjectives, check out the Adjectives to Describe Emotions worksheet.
","{'brand': ['Third Grade', 'Fourth Grade'], 'subject': ['Reading & Writing', 'Grammar', 'Grammar and Mechanics', 'Parts of Speech', 'Adjectives']}",/worksheet/article/parts-of-speech-adjectives/,https://cdn.education.com/worksheet-image/3879787/parts-speech-adjectives-2023-11-07.gif
"Volume of Cylinders, Cones, and Spheres #3","Keep practicing calculating the volume of cylinders, cones, and spheres with this eighth-grade geometry worksheet! The third in a series of three, this one-page practice worksheet asks students to find the volume of six different three-dimensional shapes, including cylinders, cones, and spheres. Using the height and radius or diameter of each shape, learners will calculate the volume and round their answers to the nearest hundredth as needed.
Don't miss the other worksheets in this series: Volume of Cylinders, Cones, and Spheres #1 and Volume of Cylinders, Cones, and Spheres #2! And for targeted practice that includes explanations and example problems, check out the Volume of Spheres, Volume of Cones, and Volume of Cylinders worksheets.
","{'brand': ['Eighth Grade'], 'subject': ['Math', 'Geometry', 'Volume', 'Volume of a Cone', 'Volume of a Sphere', 'Volume of a Cylinder']}",/worksheet/article/volume-of-cylinders-cones-and-spheres-3/,https://cdn.education.com/worksheet-image/3879750/volume-cylinders-cones-spheres-3-2023-11-07.gif
"Volume of Cylinders, Cones, and Spheres #2","Get more practice calculating the volume of cylinders, cones, and spheres with this eighth-grade geometry worksheet! The second in a series of three, this one-page practice worksheet asks students to find the volume of six different three-dimensional shapes, including cylinders, cones, and spheres. Using the height and radius or diameter of each shape, learners will calculate the volume and round their answers to the nearest hundredth as needed.
Keep going with the next worksheet in this series: Volume of Cylinders, Cones, and Spheres #3! Or, for more targeted practice with explanations and example problems, check out the Volume of Spheres, Volume of Cones, and Volume of Cylinders worksheets.
","{'brand': ['Eighth Grade'], 'subject': ['Math', 'Geometry', 'Volume', 'Volume of a Cone', 'Volume of a Sphere', 'Volume of a Cylinder']}",/worksheet/article/volume-of-cylinders-cones-and-spheres-2/,https://cdn.education.com/worksheet-image/3879728/volume-cylinders-cones-spheres-2-2023-11-07.gif
Color Two-Dimensional and Three-Dimensional Shapes #2,"Give your kindergartner more practice classifying 2D and 3D shapes with this fun coloring worksheet! The second in a series of two, this introductory geometry worksheet invites learners to first pick two colors and complete the color key. They will need to designate one color to be used for the two-dimentional, or flat, shapes, and the other color will be used for the three-dimensional, or solid, shapes. Then students will get to work shading in the various 2D and 3D shapes according to their chosen colors.
Don't miss the first worksheet in this series: Color Two-Dimensional and Three-Dimensional Shapes #1! And for more fun geometry practice, check out Find Two-Dimensional Shapes #1 and Find Two-Dimensional Shapes #2!
","{'brand': ['Kindergarten'], 'subject': ['Math', 'Geometry', '2D Shapes', '3D Shapes', 'Flat Shapes']}",/worksheet/article/color-the-two-dimensional-and-three-dimensional-shapes-2/,https://cdn.education.com/worksheet-image/3879714/color-two-dimensional-three-dimensional-2023-11-07.gif
Color Two-Dimensional and Three-Dimensional Shapes #1,"Shape, rattle, and roll! Kindergartners will love classifying 2D and 3D shapes with this fun coloring worksheet. This engaging introductory geometry worksheet invites learners to first pick two colors and complete the color key. They will need to designate one color to be used for the two-dimentional, or flat, shapes, and the other color will be used for the three-dimensional, or solid, shapes. Then students will get to work shading in the various 2D and 3D shapes according to their chosen colors.
For more fun math practice featuring a new selection of shapes, check out the Color Two-Dimensional and Three-Dimensional Shapes #2 worksheet! And keep up the geometry practice with Find Two-Dimensional Shapes #1 and Find Two-Dimensional Shapes #2!
","{'brand': ['Kindergarten'], 'subject': ['Math', 'Geometry', '2D Shapes', '3D Shapes', 'Flat Shapes']}",/worksheet/article/color-the-two-dimensional-and-three-dimensional-shapes-1/,https://cdn.education.com/worksheet-image/3879680/color-two-dimensional-three-dimensional-2023-11-07.gif
Character Quote Response: The Wizard of Oz,"Invite students to reflect on a quote by the character The Wizard of Oz from L. Frank Baum’s The Wonderful Wizard of Oz with this engaging writing worksheet. In this reflective writing exercise, students will respond with words and images as they share their interpretation of the given quote. They’ll reflect on how the quote applies to their own life or the world at large, and they’ll create a visual representation of the quote.
Analyzing quotes is an important part of interpreting and drawing meaning from an author or speaker’s words. When we closely analyze words and their impact, we build a deeper understanding of the intended meaning. Whether used as a warm-up to begin class, as a writing assessment, or as an independent assignment, this exercise is a great way to stimulate critical thinking and discussion in a middle-grade classroom. Don't miss our other high-interest character quote response worksheets!
","{'brand': ['Sixth Grade', 'Seventh Grade', 'Eighth Grade'], 'subject': ['Reading & Writing', 'Writing', 'Nonfiction Writing', 'Reflective Writing']}",/worksheet/article/character-quote-response-the-wizard-of-oz/,https://cdn.education.com/worksheet-image/3877381/character-quote-response-wizard-oz-2023-11-03.gif
Character Quote Response: John Keating From Dead Poets Society,"Invite students to reflect on a quote by the character John Keating from Tom Schulman’s movie Dead Poets Society with this engaging writing worksheet. In this reflective writing exercise, students will respond with words and images as they share their interpretation of the given quote. They’ll reflect on how the quote applies to their own life or the world at large, and they’ll create a visual representation of the quote.
Analyzing quotes is an important part of interpreting and drawing meaning from an author or speaker’s words. When we closely analyze words and their impact, we build a deeper understanding of the intended meaning. Whether used as a warm-up to begin class, as a writing assessment, or as an independent assignment, this exercise is a great way to stimulate critical thinking and discussion in a middle-grade classroom. Don't miss our other high-interest character quote response worksheets!
","{'brand': ['Sixth Grade', 'Seventh Grade', 'Eighth Grade'], 'subject': ['Reading & Writing', 'Writing', 'Nonfiction Writing', 'Reflective Writing']}",/worksheet/article/character-quote-response-john-keating-from-dead-poets-society/,https://cdn.education.com/worksheet-image/3877370/character-quote-response-john-keating-2023-11-03.gif
Character Quote Response: The Once-ler From The Lorax,"Invite students to reflect on a quote by the character The Once-ler from Dr. Seuss’s The Lorax with this engaging writing worksheet. In this reflective writing exercise, students will respond with words and images as they share their interpretation of the given quote. They’ll reflect on how the quote applies to their own life or the world at large, and they’ll create a visual representation of the quote.
Analyzing quotes is an important part of interpreting and drawing meaning from an author or speaker’s words. When we closely analyze words and their impact, we build a deeper understanding of the intended meaning. Whether used as a warm-up to begin class, as a writing assessment, or as an independent assignment, this exercise is a great way to stimulate critical thinking and discussion in a middle-grade classroom. Don't miss our other high-interest character quote response worksheets!
","{'brand': ['Sixth Grade', 'Seventh Grade', 'Eighth Grade'], 'subject': ['Reading & Writing', 'Writing', 'Nonfiction Writing', 'Reflective Writing']}",/worksheet/article/character-quote-response-the-once-ler-from-the-lorax/,https://cdn.education.com/worksheet-image/3877360/character-quote-response-once-ler-2023-11-03.gif
Evaluate Expressions Using Order of Operations #3,"Get even more practice evaluating expressions using the order of operations with the third installment of this mixed operations math worksheet! Geared toward fifth- and sixth-grade learners, this practice worksheet covers a wide range of difficulty, beginning with expressions that require two steps to evaluate and advancing to more intricate expressions that require up to five steps to evaluate. With many of the problems containing exponents, this worksheet also gives students the opportunity to practice evaluating exponents.
For more practice, check out the other two worksheets in this series: Evaluate Expressions Using Order of Operations #1 and Evaluate Expressions Using Order of Operations #2. Or, for an added challenge, try the Order of Operations Puzzle #2 worksheet!
","{'brand': ['Fifth Grade', 'Sixth Grade'], 'subject': ['Math', 'Number Sense', 'Mixed Operations', 'Exponents', 'Order of Operations']}",/worksheet/article/evaluate-expressions-using-order-of-operations-3/,https://cdn.education.com/worksheet-image/3877319/evaluate-expressions-order-operations-3-2023-11-03.gif
Vocabulary Toolkit: Vocabulary Quilt,"Encourage students to make connections as they learn new words with this vocabulary quilt activity! Adaptable to a variety of units, this creative vocabulary-building exercise gets students thinking about the meaning of a vocabulary term in the context of related words and ideas. Using the template on page 2, students will create a vocabulary quilt square that includes their word, its definition, a related sketch, a synonym or example, an antonym or non-example, and any other connections to the word that seem important.
Use this worksheet as part of your vocabulary lesson for a novel study, a history or science unit, standardized test prep, or something else! Cut out students' squares and hang them together to create a unique display for your classroom or school that also serves to expose students to important academic vocabulary.
For more creative and engaging vocabulary worksheets, check out our Vocabulary Toolkit set!
","{'brand': ['Fourth Grade', 'Fifth Grade', 'Sixth Grade', 'Seventh Grade', 'Eighth Grade'], 'subject': ['Reading & Writing', 'Grammar', 'Teacher Resources', 'Language and Vocabulary', 'Vocabulary']}",/worksheet/article/vocabulary-toolkit-vocabulary-quilt/,https://cdn.education.com/worksheet-image/3876554/vocabulary-toolkit-vocabulary-quilt-2023-11-02.gif
Vocabulary Toolkit: Multiple-Meaning Words Graphic Organizer,"Use this multiple-meaning words worksheet to support middle school students as they explore a word with more than one meaning! This one-page graphic organizer features a place for students to record the word at the top, as well as spaces for them to record two different meanings, parts of speech, sentences using the word, and illustrations depicting the word's meanings.

Explicit vocabulary instruction and tools like this support English Language Learners and students needing additional vocabulary development. This graphic organizer is intentionally flexible to best support instruction in a middle school classroom or at home.
Interested in more versatile vocabulary worksheets for older students? Check out our Vocabulary Toolkit set!
","{'brand': ['Fourth Grade', 'Fifth Grade', 'Sixth Grade', 'Seventh Grade', 'Eighth Grade'], 'subject': ['Reading & Writing', 'Grammar', 'Teacher Resources', 'Language and Vocabulary', 'Language', 'Vocabulary', 'Homophones and Homographs']}",/worksheet/article/vocabulary-toolkit-multiple-meaning-words-graphic-organizer/,https://cdn.education.com/worksheet-image/3876520/multiple-meaning-words-graphic-organizer-2024-02-09.gif
Greek and Latin Affixes #2,"Dig deeper into Greek and Latin affixes while growing your vocabulary with this eighth-grade worksheet! Many words in the English language are formed by adding affixes—prefixes and suffixes—that change the meaning of the root word. Familiarity with Greek and Latin affixes helps students connect new and unfamiliar words, which in turn supports their understanding of word meanings. The more affixes they know, the more their vocabulary will improve! 
In this one-page grammar worksheet, students will analyze groups of words to identify the shared Greek or Latin affix. Learners will determine the meaning of the affix and then write another word that also features the affix, recording its meaning in the space provided.
Looking for more vocabulary-building worksheets? Don't miss Greek and Latin Affixes #1!
","{'brand': ['Eighth Grade'], 'subject': ['Reading & Writing', 'Grammar', 'Language and Vocabulary', 'Vocabulary', 'Determining Meaning Using Roots, Prefixes, and Suffixes']}",/worksheet/article/greek-and-latin-affixes-2/,https://cdn.education.com/worksheet-image/3876485/greek-latin-affixes-2-2023-11-02.gif
Word Ladder: Short U CVC Words,"Provide students with engaging word study practice using this short U word ladder worksheet! Geared toward first-grade learners, this worksheet gives students practice with decoding and encoding short U CVC words, such as sun and jug. Learners will start at the bottom of the ladder, changing one letter from each word to create new words as they make their way to the top. The picture clues provide helpful guidance as learners map the words in the boxes and then record the words on the lines.
Word ladders are a wonderful tool to help students understand that words can be changed by adding or deleting letters, which builds a strong foundation of phonemic awareness. For more phonics practice with word ladders, check out the rest of the short vowel CVC word ladder worksheets!
","{'brand': ['First Grade'], 'subject': ['Reading & Writing', 'Grammar', 'Phonics', 'Letter Sounds', 'Vowels', 'Decoding Words', 'Long U/Short U']}",/worksheet/article/word-ladder-short-u-cvc-words/,https://cdn.education.com/worksheet-image/3876240/word-ladder-short-cvc-words-2023-11-02.gif
Word Ladder: Short O CVC Words,"Provide students with engaging word study practice using this short O word ladder worksheet! Geared toward first-grade learners, this worksheet gives students practice with decoding and encoding short O CVC words, such as mop and hot. Learners will start at the bottom of the ladder, changing one letter from each word to create new words as they make their way to the top. The picture clues provide helpful guidance as learners map the words in the boxes and then record the words on the lines.
Word ladders are a wonderful tool to help students understand that words can be changed by adding or deleting letters, which builds a strong foundation of phonemic awareness. For more phonics practice with word ladders, check out the rest of the short vowel CVC word ladder worksheets!
","{'brand': ['First Grade'], 'subject': ['Reading & Writing', 'Grammar', 'Phonics', 'Letter Sounds', 'Vowels', 'Decoding Words', 'Long O/Short O']}",/worksheet/article/word-ladder-short-o-cvc-words/,https://cdn.education.com/worksheet-image/3876231/word-ladder-short-cvc-words-2023-11-02.gif
Word Ladder: Short I CVC Words,"Provide students with engaging word study practice using this short I word ladder worksheet! Geared toward first-grade learners, this worksheet gives students practice with decoding and encoding short I CVC words, such as bin and pig. Learners will start at the bottom of the ladder, changing one letter from each word to create new words as they make their way to the top. The picture clues provide helpful guidance as learners map the words in the boxes and then record the words on the lines.
Word ladders are a wonderful tool to help students understand that words can be changed by adding or deleting letters, which builds a strong foundation of phonemic awareness. For more phonics practice with word ladders, check out the rest of the short vowel CVC word ladder worksheets!
","{'brand': ['First Grade'], 'subject': ['Reading & Writing', 'Grammar', 'Phonics', 'Letter Sounds', 'Vowels', 'Decoding Words', 'Long I/Short I']}",/worksheet/article/word-ladder-short-i-cvc-words/,https://cdn.education.com/worksheet-image/3876223/word-ladder-short-cvc-words-2023-11-02.gif
Word Ladder: Short E CVC Words,"Provide students with engaging word study practice using this short E word ladder worksheet! Geared toward first-grade learners, this worksheet gives students practice with decoding and encoding short E CVC words, such as web and beg. Learners will start at the bottom of the ladder, changing one letter from each word to create new words as they make their way to the top. The picture clues provide helpful guidance as learners map the words in the boxes and then record the words on the lines.
Word ladders are a wonderful tool to help students understand that words can be changed by adding or deleting letters, which builds a strong foundation of phonemic awareness. For more phonics practice with word ladders, check out the rest of the short vowel CVC word ladder worksheets!
","{'brand': ['First Grade'], 'subject': ['Reading & Writing', 'Grammar', 'Phonics', 'Letter Sounds', 'Vowels', 'Decoding Words', 'Long E/Short E']}",/worksheet/article/word-ladder-short-e-cvc-words/,https://cdn.education.com/worksheet-image/3874972/word-ladder-short-cvc-words-2023-10-31.gif
