title,activity_contents,categories,url,thumbnail
Spring Creative Writing Prompt #1: The Puzzling Picnic,"Invite your students to practice their creative storytelling with this fun, spring-themed writing prompt about a startling find in the picnic cooler! Using the prompt as an inspiring starting point, students are invited to write a creative story that includes interesting characters, descriptive language, and an engaging plot with a clear conflict and resolution. Ideal for a wide range of learners in grades four through eight, this writing prompt is a great way to allow learners to practice their creative writing and storytelling skills.
This worksheet can be used independently or completed alongside our other worksheets in this series: Spring Creative Writing Prompt #2: Foul Ball Fiasco and Spring Creative Writing Prompt #3: Sifting Through the Sand.
","{'brand': ['Fourth Grade', 'Fifth Grade', 'Sixth Grade', 'Seventh Grade', 'Eighth Grade'], 'subject': ['Reading & Writing', 'Writing', 'Seasonal', 'Fiction Writing', 'Spring', 'Creative Writing']}",/worksheet/article/spring-creative-writing-prompt-1-the-puzzling-picnic/,https://cdn.education.com/worksheet-image/3906186/spring-creative-writing-prompt-1-2023-12-13.gif
Logic Puzzle #1: Outdoor Fun,"Introduce second- and third-grade learners to the exciting world of logic puzzles with this engaging worksheet! Meet Rita, Harry, Frank, and Zoe. These four friends love racing each other outside in the sunshine. Each friend brings a helmet and rides something different for ultimate outdoor fun. Learners will need to use the clues, the provided 4 x 4 grid, and their logic and reasoning skills to figure out who rides the roller blades, the bike, the scooter, and the skateboard.
 
Logic puzzles like these are a great way to strengthen students' math reasoning and critical thinking skills. Ready for a bit more of a challenge? Try the Logic Puzzle #1: Harriet’s Hats worksheet next!
","{'brand': ['Second Grade', 'Third Grade'], 'subject': ['Math', 'Math Puzzles', 'Offline games', 'Puzzles & Sudoku']}",/worksheet/article/logic-puzzle-1-outdoor-fun/,https://cdn.education.com/worksheet-image/3905970/logic-puzzle-1-outdoor-fun-2023-12-13.gif
Color the Cars: Number 3,"Can you find all the number 3s? Give your young learner fun number identification practice with this car-themed math coloring worksheet! Early learners will look at 10 cars labeled with numbers 1 through 5 and color all of the cars with the number 3. Perfect for your youngest learners in preschool and pre-kindergarten, this simple and inviting worksheet is a great way to build students' number sense and grow their confidence recognizing numbers 1–10.
This worksheet is the third in a series of 10 car-themed number identification worksheets. Keep learning with Color the Cars: Number 4 next! Or check out the full set of our Color the Cars worksheets to download all 10!
","{'brand': ['Preschool'], 'subject': ['Math', 'Number Sense', 'Coloring', 'Numbers 0-10', 'Vehicles', 'Identifying Numbers 0-10']}",/worksheet/article/color-the-cars-number-3/,https://cdn.education.com/worksheet-image/3905324/color-cars-number-3-2023-12-12.gif
Color the Cars: Number 4,"Can you find all the number 4s? Give your young learner fun number identification practice with this car-themed math coloring worksheet! Early learners will look at 10 cars labeled with numbers 1 through 5 and color all of the cars with the number 4. Perfect for your youngest learners in preschool and pre-kindergarten, this simple and inviting worksheet is a great way to build students' number sense and grow their confidence recognizing numbers 1–10.
This worksheet is the fourth in a series of 10 car-themed number identification worksheets. Keep learning with Color the Cars: Number 5 next! Or check out the full set of our Color the Cars worksheets to download all 10!
","{'brand': ['Preschool'], 'subject': ['Math', 'Number Sense', 'Coloring', 'Numbers 0-10', 'Vehicles', 'Identifying Numbers 0-10']}",/worksheet/article/color-the-cars-number-4/,https://cdn.education.com/worksheet-image/3905325/color-cars-number-4-2023-12-12.gif
Color the Cars: Number 2,"Can you find all the number 2s? Give your young learner fun number identification practice with this car-themed math coloring worksheet! Early learners will look at 10 cars labeled with numbers 1 through 5 and color all of the cars with the number 2. Perfect for your youngest learners in preschool and pre-kindergarten, this simple and inviting worksheet is a great way to build students' number sense and grow their confidence recognizing numbers 1–10.
This worksheet is the second in a series of 10 car-themed number identification worksheets. Keep learning with Color the Cars: Number 3 next! Or check out the full set of our Color the Cars worksheets to download all 10!
","{'brand': ['Preschool'], 'subject': ['Math', 'Number Sense', 'Coloring', 'Numbers 0-10', 'Vehicles', 'Identifying Numbers 0-10']}",/worksheet/article/color-the-cars-number-2/,https://cdn.education.com/worksheet-image/3905313/color-cars-number-2-2023-12-12.gif
Color the Cars: Number 1,"Can you find all the number 1s? Give your young learner fun number identification practice with this car-themed math worksheet! Early learners will look at 10 cars labeled with numbers 1 through 5 and color all of the cars with the number 1. Perfect for your youngest learners in preschool and pre-kindergarten, this simple and inviting worksheet is a great way to build students' number sense and grow their confidence recognizing numbers 1–10. Along the way, learners will enjoy picking out which colors to use and working on their fine motor skills as they color in the correct vehicles.
This math coloring worksheet is the first in a series of 10 car-themed number identification worksheets. Keep learning with Color the Cars: Number 2 next! Or check out the full set of our Color the Cars worksheets to download all 10!
","{'brand': ['Preschool'], 'subject': ['Math', 'Number Sense', 'Coloring', 'Numbers 0-10', 'Vehicles', 'Identifying Numbers 0-10']}",/worksheet/article/color-the-cars-number-1/,https://cdn.education.com/worksheet-image/3902907/color-cars-number-1-2023-12-08.gif
"Open Number Line Addition Within 1,000: Write the Equation #3","Continue exploring properties of operations while writing addition equations with the third installment of this hands-on math worksheet! Geared toward second graders, this one-page worksheet includes five problems featuring open number lines with arrows that represent three-digit addition equations within 1,000. Students are asked to use the work shown on the concrete models to write the matching addition equations in the template provided, including both addends and the sum.
Number lines offer students a concrete model to help them visualize the addition process. Get more targeted practice with the other worksheets in this series: Open Number Line Addition Within 1,000: Write the Equation #1 and Open Number Line Addition Within 1,000: Write the Equation #2.
","{'brand': ['Second Grade'], 'subject': ['Math', 'Addition', 'Multi-Digit Addition', 'Addition Strategies', 'Three-Digit Addition', 'Addition on a Number Line']}",/worksheet/article/open-number-line-addition-within-1000-write-the-equation-3/,https://cdn.education.com/worksheet-image/3902800/open-number-line-addition-1000-2023-12-08.gif
Reading Calendar Days and Dates: January 2024,"Children will practice identifying and writing calendar days and dates in January in this engaging calendar math worksheet. This one-page worksheet invites learners to follow a series of prompts and questions about days and dates in January, using the calendar provided to locate the answers. Designed for a first-, second-, and third-grade curriculum, this versatile worksheet reinforces skills including dates, capitalization, punctuation, and calendar math.
Keep going with the Reading Calendar Days and Dates: February 2024 worksheet! Or check out for the full set of 2024 Calendar Days and Dates to print out all 12 to have students complete them throughout the year.
","{'brand': ['First Grade', 'Second Grade', 'Third Grade'], 'subject': ['Reading & Writing', 'Grammar', 'Grammar and Mechanics', 'Punctuation', 'Capitalization', 'Commas']}",/worksheet/article/day-and-date-january/,https://cdn.education.com/worksheet-image/971050/january-2017-day-date-2023-12-08.gif
Reading Calendar Days and Dates: February 2024,"Children will practice identifying and writing calendar days and dates in February in this engaging calendar math worksheet. This one-page worksheet invites learners to follow a series of prompts and questions about days and dates in February, using the calendar provided to locate the answers. Designed for a first-, second-, and third-grade curriculum, this versatile worksheet reinforces skills including dates, capitalization, punctuation, and calendar math.
Keep going with the Reading Calendar Days and Dates: March 2024 worksheet! Or check out for the full set of 2024 Calendar Days and Dates to print out all 12 to have students complete them throughout the year.
","{'brand': ['First Grade', 'Second Grade', 'Third Grade'], 'subject': ['Reading & Writing', 'Grammar', 'Grammar and Mechanics', 'Punctuation', 'Capitalization', 'Commas']}",/worksheet/article/day-and-date-february/,https://cdn.education.com/worksheet-image/1073322/february-2017-day-date-2023-12-08.gif
Reading Calendar Days and Dates: March 2024,"Children will practice identifying and writing calendar days and dates in March in this engaging calendar math worksheet. This one-page worksheet invites learners to follow a series of prompts and questions about days and dates in March, using the calendar provided to locate the answers. Designed for a first, second, and third grade curriculum, this versatile worksheet reinforces skills including dates, capitalization, punctuation, and calendar math.
Keep going with the Reading Calendar Days and Dates: April 2024 worksheet! Or check out for the full set of 2024 Calendar Days and Dates to print out all 12 to have students complete them throughout the year.
","{'brand': ['First Grade', 'Second Grade', 'Third Grade'], 'subject': ['Reading & Writing', 'Grammar', 'Grammar and Mechanics', 'Punctuation', 'Capitalization', 'Commas']}",/worksheet/article/day-and-date-march/,https://cdn.education.com/worksheet-image/971063/march-2017-day-date-2023-12-08.gif
Reading Calendar Days and Dates: April 2024,"Children will practice identifying and writing calendar days and dates in April in this engaging calendar math worksheet. This one-page worksheet invites learners to follow a series of prompts and questions about days and dates in April, using the calendar provided to locate the answers. Designed for a first, second, and third grade curriculum, this versatile worksheet reinforces skills including dates, capitalization, punctuation, and calendar math.
Keep going with the Reading Calendar Days and Dates: May 2024 worksheet! Or check out for the full set of 2024 Calendar Days and Dates to print out all 12 to have students complete them throughout the year.
","{'brand': ['First Grade', 'Second Grade', 'Third Grade'], 'subject': ['Reading & Writing', 'Grammar', 'Grammar and Mechanics', 'Punctuation', 'Capitalization', 'Commas']}",/worksheet/article/day-and-date-april/,https://cdn.education.com/worksheet-image/1073343/april-2017-day-date-2023-12-08.gif
Reading Calendar Days and Dates: May 2024,"Children will practice identifying and writing calendar days and dates in May in this engaging calendar math worksheet. This one-page worksheet invites learners to follow a series of prompts and questions about days and dates in May, using the calendar provided to locate the answers. Designed for a first, second, and third grade curriculum, this versatile worksheet reinforces skills including dates, capitalization, punctuation, and calendar math.
Keep going with the Reading Calendar Days and Dates: June 2024 worksheet! Or check out for the full set of 2024 Calendar Days and Dates to print out all 12 to have students complete them throughout the year.
","{'brand': ['First Grade', 'Second Grade', 'Third Grade'], 'subject': ['Reading & Writing', 'Grammar', 'Grammar and Mechanics', 'Punctuation', 'Capitalization', 'Commas']}",/worksheet/article/day-and-date-may/,https://cdn.education.com/worksheet-image/971082/2017-day-date-2023-12-08.gif
Reading Calendar Days and Dates: June 2024,"Children will practice identifying and writing calendar days and dates in June in this engaging calendar math worksheet. This one-page worksheet invites learners to follow a series of prompts and questions about days and dates in June, using the calendar provided to locate the answers. Designed for a first, second, and third grade curriculum, this versatile worksheet reinforces skills including dates, capitalization, punctuation, and calendar math.
Keep going with the Reading Calendar Days and Dates: July 2024 worksheet! Or check out for the full set of 2024 Calendar Days and Dates to print out all 12 to have students complete them throughout the year.
","{'brand': ['First Grade', 'Second Grade', 'Third Grade'], 'subject': ['Reading & Writing', 'Grammar', 'Grammar and Mechanics', 'Punctuation', 'Capitalization', 'Commas']}",/worksheet/article/day-and-date-june/,https://cdn.education.com/worksheet-image/1073355/june-2017-day-date-2023-12-08.gif
Reading Calendar Days and Dates: July 2024,"Children will practice identifying and writing calendar days and dates in July in this engaging calendar math worksheet. This one-page worksheet invites learners to follow a series of prompts and questions about days and dates in July, using the calendar provided to locate the answers. Designed for a first, second, and third grade curriculum, this versatile worksheet reinforces skills including dates, capitalization, punctuation, and calendar math.
Keep going with the Reading Calendar Days and Dates: August 2024 worksheet! Or check out for the full set of 2024 Calendar Days and Dates to print out all 12 to have students complete them throughout the year.
","{'brand': ['First Grade', 'Second Grade', 'Third Grade'], 'subject': ['Reading & Writing', 'Grammar', 'Grammar and Mechanics', 'Punctuation', 'Capitalization', 'Commas']}",/worksheet/article/day-and-date-july/,https://cdn.education.com/worksheet-image/1073361/july-2017-day-date-2023-12-08.gif
Reading Calendar Days and Dates: August 2024,"Children will practice identifying and writing calendar days and dates in August in this engaging calendar math worksheet. This one-page worksheet invites learners to follow a series of prompts and questions about days and dates in August, using the calendar provided to locate the answers. Designed for a first, second, and third grade curriculum, this versatile worksheet reinforces skills including dates, capitalization, punctuation, and calendar math.
Keep going with the Reading Calendar Days and Dates: September 2024 worksheet! Or check out for the full set of 2024 Calendar Days and Dates to print out all 12 to have students complete them throughout the year.
","{'brand': ['First Grade', 'Second Grade', 'Third Grade'], 'subject': ['Reading & Writing', 'Grammar', 'Grammar and Mechanics', 'Punctuation', 'Capitalization', 'Commas']}",/worksheet/article/day-and-date-august/,https://cdn.education.com/worksheet-image/971109/august-2017-day-date-2023-12-08.gif
Reading Calendar Days and Dates: September 2024,"Children will practice identifying and writing calendar days and dates in September in this engaging calendar math worksheet. This one-page worksheet invites learners to follow a series of prompts and questions about days and dates in September, using the calendar provided to locate the answers. Designed for a first, second, and third grade curriculum, this versatile worksheet reinforces skills including dates, capitalization, punctuation, and calendar math.
Keep going with the Reading Calendar Days and Dates: October 2024 worksheet! Or check out for the full set of 2024 Calendar Days and Dates to print out all 12 to have students complete them throughout the year.
","{'brand': ['First Grade', 'Second Grade', 'Third Grade'], 'subject': ['Reading & Writing', 'Grammar', 'Grammar and Mechanics', 'Punctuation', 'Capitalization', 'Commas']}",/worksheet/article/day-and-date-september/,https://cdn.education.com/worksheet-image/971115/september-2017-day-date-2023-12-08.gif
Reading Calendar Days and Dates: October 2024,"Children will practice identifying and writing calendar days and dates in October in this engaging calendar math worksheet. This one-page worksheet invites learners to follow a series of prompts and questions about days and dates in October, using the calendar provided to locate the answers. Designed for a first, second, and third grade curriculum, this versatile worksheet reinforces skills including dates, capitalization, punctuation, and calendar math.
Keep going with the Reading Calendar Days and Dates: November 2024 worksheet! Or check out for the full set of 2024 Calendar Days and Dates to print out all 12 to have students complete them throughout the year.
","{'brand': ['First Grade', 'Second Grade', 'Third Grade'], 'subject': ['Reading & Writing', 'Grammar', 'Grammar and Mechanics', 'Punctuation', 'Capitalization', 'Commas']}",/worksheet/article/day-and-date-october/,https://cdn.education.com/worksheet-image/1073379/october-2017-day-date-2023-12-08.gif
Reading Calendar Days and Dates: November 2024,"Children will practice identifying and writing calendar days and dates in November in this engaging calendar math worksheet. This one-page worksheet invites learners to follow a series of prompts and questions about days and dates in November, using the calendar provided to locate the answers. Designed for a first, second, and third grade curriculum, this versatile worksheet reinforces skills including dates, capitalization, punctuation, and calendar math.
Keep going with the Reading Calendar Days and Dates: December 2024 worksheet! Or check out for the full set of 2024 Calendar Days and Dates to print out all 12 to have students complete them throughout the year.
","{'brand': ['First Grade', 'Second Grade', 'Third Grade'], 'subject': ['Reading & Writing', 'Grammar', 'Grammar and Mechanics', 'Punctuation', 'Capitalization', 'Commas']}",/worksheet/article/day-and-date-november/,https://cdn.education.com/worksheet-image/971070/november-2017-day-date-2023-12-08.gif
Reading Calendar Days and Dates: December 2024,"Children will practice identifying and writing calendar days and dates in December in this engaging calendar math worksheet. This one-page worksheet invites learners to follow a series of prompts and questions about days and dates in December, using the calendar provided to locate the answers. Designed for a first, second, and third grade curriculum, this versatile worksheet reinforces skills including dates, capitalization, punctuation, and calendar math.
Looking to start at the beginning? Don't miss the Reading Calendar Days and Dates: January 2024 worksheet! Or check out for the full set of 2024 Calendar Days and Dates to print out all 12 to have students complete them throughout the year.
","{'brand': ['First Grade', 'Second Grade', 'Third Grade'], 'subject': ['Reading & Writing', 'Grammar', 'Grammar and Mechanics', 'Punctuation', 'Capitalization', 'Commas']}",/worksheet/article/day-and-date-december/,https://cdn.education.com/worksheet-image/971132/december-2017-day-date-2024-01-01.gif
Figurative Language Maze: Winter Metaphors,"Practice identifying metaphors with this fun, winter-themed figurative language maze! Geared toward middle-grade learners, this figurative language worksheet invites students to find the path through the maze by identifying only the spaces containing metaphors. As they follow the path from start to finish, students will need to rely on their knowledge of figurative language to identify only the metaphors while avoiding similes, personification, and other figurative language techniques. Along the way, learners will collect letters that they will use to complete the mystery metaphor at the bottom of the page.
For more engaging seasonal grammar practice, check out the Figurative Language Maze: Winter Similes and Figurative Language Maze: Winter Hyperbole worksheets!
","{'brand': ['Sixth Grade', 'Seventh Grade', 'Eighth Grade'], 'subject': ['Reading & Writing', 'Grammar', 'Seasonal', 'Winter', 'Language and Vocabulary', 'Language', 'Figurative Language', 'Metaphors']}",/worksheet/article/figurative-language-maze-winter-metaphors/,https://cdn.education.com/worksheet-image/3902129/figurative-language-maze-winter-metaphors-2023-12-07.gif
Logic Puzzle #1: Harriet’s Hats,"Strengthen students' logic and critical thinking skills with this engaging logic puzzle! Meet Harriet, who just adores hats. In fact, Harriet has so many hats that she will only wear one kind of hat to each place she visits. Students will need to use the clues, the provided 5 x 5 grid, and their logic and reasoning skills to figure out where Harriet wears each of her hats!
Designed for third- and fourth-grade learners, this fun hat-themed logic puzzle is a great way to help students improve their math reasoning skills. For more fun logic practice, check out Logic Puzzle #2: Fair Ride Frenzy next!
","{'brand': ['Third Grade', 'Fourth Grade'], 'subject': ['Math', 'Math Puzzles', 'Offline games', 'Puzzles & Sudoku']}",/worksheet/article/logic-puzzle-1-harriets-hats/,https://cdn.education.com/worksheet-image/3902091/logic-puzzle-1-harriet-hats-2023-12-07.gif
Grammar Review: Adjectives and Adverbs,"Help students understand and recognize the difference between adjectives and adverbs with this grammar review worksheet! This one-page practice worksheet begins with a review of the key differences between adjectives and adverbs, reminding students that adjectives describe or modify a noun or pronoun and adverbs describe or modify a verb, adjective, or another adverb. After reviewing the provided explanations and examples, learners will practice differentiating between adverbs and adjectives in the context of 12 written sentences.
Geared toward sixth-, seventh-, and eighth-grade learners, this helpful grammar worksheet is a great way to review these important parts of speech while improving students' grasp of the written and spoken English language.
Encourage students to build their own catalog of adjective and adverb vocabulary words to use in their writing with the Other Ways to Say It: Common Adjectives #1 and Other Ways to Say It: Common Adverbs #1 worksheets.
","{'brand': ['Sixth Grade', 'Seventh Grade', 'Eighth Grade'], 'subject': ['Reading & Writing', 'Grammar', 'Grammar and Mechanics', 'Parts of Speech', 'Adverbs', 'Adjectives']}",/worksheet/article/grammar-review-adjectives-and-adverbs/,https://cdn.education.com/worksheet-image/3901881/grammar-review-adjectives-adverbs-2023-12-07.gif
Fall Argument Writing Prompt #3: Holiday Shopping,"Should stores be required to stay open on holidays? Have students practice their argumentative writing with this fall-themed writing prompt! Designed for sixth-, seventh-, and eighth-grade learners, this opinion-writing prompt will engage students as they explore and articulate their thoughts around the topic of requiring stores to stay open on holidays. Students are asked to address the question, support their claim with relevant evidence and reasoning, and acknowledge different opinions and perspectives on the matter.
This nonfiction writing prompt can be used independently or alongside the other fall writing prompts in this series: Fall Argument Writing Prompt #1: Fall Break and Fall Argument Writing Prompt #2: Dress Code. Looking for a rubric to accompany this prompt? Check out our 6th grade, 7th grade, or 8th grade standards-based argument writing rubrics.
","{'brand': ['Sixth Grade', 'Seventh Grade', 'Eighth Grade'], 'subject': ['Reading & Writing', 'Writing', 'Seasonal', 'Fall', 'Nonfiction Writing', 'Argument Writing']}",/worksheet/article/fall-argument-writing-prompt-3-holiday-shopping/,https://cdn.education.com/worksheet-image/3901685/fall-argument-writing-prompt-3-2023-12-07.gif
Fall Argument Writing Prompt #2: Dress Code,"With temperatures cooling down, should students be allowed to wear hats and hoods in school? Have students practice their argumentative writing with this fall-themed writing prompt! Designed for sixth-, seventh-, and eighth-grade learners, this opinion-writing prompt will engage students as they explore and articulate their thoughts around the topic of school dress codes. Students are asked to address the question, support their claim with relevant evidence and reasoning, and acknowledge different opinions and perspectives on the matter.
This nonfiction writing prompt can be used independently or alongside the other fall writing prompts in this series: Fall Argument Writing Prompt #1: Fall Break and Fall Argument Writing Prompt #3: Holiday Shopping. Looking for a rubric to accompany this prompt? Check out our 6th grade, 7th grade, or 8th grade standards-based argument writing rubrics.
","{'brand': ['Sixth Grade', 'Seventh Grade', 'Eighth Grade'], 'subject': ['Reading & Writing', 'Writing', 'Seasonal', 'Fall', 'Nonfiction Writing', 'Argument Writing']}",/worksheet/article/fall-argument-writing-prompt-2-dress-code/,https://cdn.education.com/worksheet-image/3901676/fall-argument-writing-prompt-2-2023-12-07.gif
